Name	Protein identifier	Contig id	Start	Stop	Strand	Gene symbol	Sequence name	Scope	Element type	Element subtype	Class	Subclass	Method	Target length	Reference sequence length	% Coverage of reference sequence	% Identity to reference sequence	Alignment length	Accession of closest sequence	Name of closest sequence	HMM id	HMM description
ARLG1933	NA	NGII01000005.1	144378	145853	-	amvA	multidrug efflux MFS transporter AmvA	plus	AMR	AMR	EFFLUX	EFFLUX	BLASTX	492	492	100.00	99.39	492	ACQ82816.1	multidrug efflux MFS transporter AmvA	NA	NA
ARLG1933	NA	NGII01000011.1	316862	318109	-	nreB	nickel resistance MFS transporter NreB	plus	STRESS	METAL	NICKEL	NICKEL	BLASTX	416	416	100.00	97.84	416	ADY84088.1	nickel resistance MFS transporter NreB	NA	NA
ARLG1933	NA	NGII01000019.1	65093	65914	-	blaOXA-940	OXA-51 family carbapenem-hydrolyzing class D beta-lactamase OXA-940	core	AMR	AMR	BETA-LACTAM	CARBAPENEM	ALLELEX	274	274	100.00	100.00	274	WP_086442870.1	OXA-51 family carbapenem-hydrolyzing class D beta-lactamase OXA-940	NA	NA
ARLG1933	NA	NGII01000026.1	85808	87094	-	abaF	fosfomycin efflux MFS transporter AbaF	plus	AMR	AMR	FOSFOMYCIN	FOSFOMYCIN	BLASTX	429	429	100.00	99.77	429	ABO11759.2	fosfomycin efflux MFS transporter AbaF	NA	NA
ARLG1933	NA	NGII01000039.1	24562	25710	+	blaADC-251	extended-spectrum class C beta-lactamase ADC-251	core	AMR	AMR	BETA-LACTAM	CEPHALOSPORIN	ALLELEX	383	383	100.00	100.00	383	WP_086443396.1	extended-spectrum class C beta-lactamase ADC-251	NA	NA
